{
  "schema_version": "1",
  "registry_class": "operator_export",
  "description": "Frozen, human-reviewed snapshot of the 10 Wikimedia Commons candidates from gehrig-content-discovery.yml run 32066959698 (2026-08-17), approved for use on the LGFC website by Bill Hunter after reviewing each item's real Commons-asserted license, attribution, and caption data. This file -- not a fresh live re-scrape -- is the source of truth for import/approval/ingestion, so what gets ingested is provably the same 10 items that were reviewed and approved.",
  "registry_purpose": "operator_export",
  "content_evidence_level": "operator_verified",
  "updated_at": "2026-08-17T21:00:00.000Z",
  "candidates": [
    {
      "candidate_id": "lgfc-gehrig-2026-511",
      "input_stream": "scheduled_discovery",
      "title": "File:GehrigCU.jpg",
      "source_name": "Wikimedia Commons",
      "source_type": "archive",
      "source_domain": "commons.wikimedia.org",
      "source_url": "https://commons.wikimedia.org/wiki/File:GehrigCU.jpg",
      "content_type": "photo",
      "summary": "Lou Gehrig in Columbia uniform, 1921 (Wikimedia Commons caption, uploader-provided -- not independently verified.)",
      "date_or_period": "1921, before playing with the Hartford Senators in 1921",
      "people_tags": ["Lou Gehrig"],
      "topic_tags": ["baseball"],
      "location_tags": [],
      "credit_line": "http://www.columbia.edu/cu/alumni/Magazine/images/Fall2001/GehrigCU.jpg",
      "provenance_notes": "Wikimedia Commons discovery for query \"Lou Gehrig\", frozen from run 32066959698 (2026-08-17). License template: Public domain. Asserted creator: University Archives—Columbiana Library, Columbia University. License template is an uploader assertion, not a verified fact -- mislabeled licenses are a known, recurring problem on Commons.",
      "rights_status": "unknown",
      "source_trust_status": "trusted",
      "relevance_status": "relevant",
      "review_status": "pending_review",
      "publication_status": "not_ready",
      "privacy_flag": "none",
      "privacy_review_status": "not_applicable",
      "review_priority": "normal",
      "admin_notes": "Frozen approved-batch fixture for #3552. Rights conclusion recorded separately via rights_evidence per #3551's core safety rule.",
      "source_metadata": {
        "source_record_id": "File:GehrigCU.jpg",
        "date_accessed": "2026-08-17",
        "source_citation": "Wikimedia Commons, File:GehrigCU.jpg"
      },
      "created_at": "2026-08-17T21:00:00.000Z",
      "updated_at": "2026-08-17T21:00:00.000Z"
    },
    {
      "candidate_id": "lgfc-gehrig-2026-512",
      "input_stream": "scheduled_discovery",
      "title": "File:HOF Gehrig Lou plaque.jpg",
      "source_name": "Wikimedia Commons",
      "source_type": "archive",
      "source_domain": "commons.wikimedia.org",
      "source_url": "https://commons.wikimedia.org/wiki/File:HOF_Gehrig_Lou_plaque.jpg",
      "content_type": "photo",
      "summary": "Lou Gehrig's Baseball Hall of Fame Plaque. (Wikimedia Commons caption, uploader-provided -- not independently verified.)",
      "date_or_period": "Commons upload by UCinternational, 10 January 2008 (UTC)",
      "people_tags": ["Lou Gehrig"],
      "topic_tags": ["baseball"],
      "location_tags": [],
      "credit_line": "From en.wikipedia; description page is (was) here",
      "provenance_notes": "Wikimedia Commons discovery for query \"Lou Gehrig\", frozen from run 32066959698 (2026-08-17). License template: Public domain. Asserted creator: User R on en.wikipedia. License template is an uploader assertion, not a verified fact -- mislabeled licenses are a known, recurring problem on Commons.",
      "rights_status": "unknown",
      "source_trust_status": "trusted",
      "relevance_status": "relevant",
      "review_status": "pending_review",
      "publication_status": "not_ready",
      "privacy_flag": "none",
      "privacy_review_status": "not_applicable",
      "review_priority": "normal",
      "admin_notes": "Frozen approved-batch fixture for #3552. Rights conclusion recorded separately via rights_evidence per #3551's core safety rule.",
      "source_metadata": {
        "source_record_id": "File:HOF Gehrig Lou plaque.jpg",
        "date_accessed": "2026-08-17",
        "source_citation": "Wikimedia Commons, File:HOF Gehrig Lou plaque.jpg"
      },
      "created_at": "2026-08-17T21:00:00.000Z",
      "updated_at": "2026-08-17T21:00:00.000Z"
    },
    {
      "candidate_id": "lgfc-gehrig-2026-513",
      "input_stream": "scheduled_discovery",
      "title": "File:Jimmie Foxx, Babe Ruth, Lou Gehrig, Al Simmons.jpg",
      "source_name": "Wikimedia Commons",
      "source_type": "archive",
      "source_domain": "commons.wikimedia.org",
      "source_url": "https://commons.wikimedia.org/wiki/File:Jimmie_Foxx,_Babe_Ruth,_Lou_Gehrig,_Al_Simmons.jpg",
      "content_type": "photo",
      "summary": "Baseball players Jimmie Foxx, Babe Ruth, Lou Gehrig, and Al Simmons (Wikimedia Commons caption, uploader-provided -- not independently verified.)",
      "date_or_period": "between 1925 and 1932",
      "people_tags": ["Lou Gehrig", "Babe Ruth", "Jimmie Foxx", "Al Simmons"],
      "topic_tags": ["baseball"],
      "location_tags": [],
      "credit_line": "Foxx - Ruth - Gehrig - Cochrane, via Wikimedia Commons (CC BY 1.0)",
      "provenance_notes": "Wikimedia Commons discovery for query \"Lou Gehrig\", frozen from run 32066959698 (2026-08-17). License template: CC BY 1.0 (https://creativecommons.org/licenses/by/1.0) -- a conditioned grant requiring attribution, not a public-domain assertion. Asserted creator: unattributed. License template is an uploader assertion, not a verified fact.",
      "rights_status": "unknown",
      "source_trust_status": "trusted",
      "relevance_status": "relevant",
      "review_status": "pending_review",
      "publication_status": "not_ready",
      "privacy_flag": "none",
      "privacy_review_status": "not_applicable",
      "review_priority": "normal",
      "admin_notes": "Frozen approved-batch fixture for #3552. CC BY 1.0 -- attribution required as a condition of use; credit_line expanded accordingly. Rights conclusion recorded separately via rights_evidence per #3551's core safety rule.",
      "source_metadata": {
        "source_record_id": "File:Jimmie Foxx, Babe Ruth, Lou Gehrig, Al Simmons.jpg",
        "date_accessed": "2026-08-17",
        "source_citation": "Wikimedia Commons, File:Jimmie Foxx, Babe Ruth, Lou Gehrig, Al Simmons.jpg"
      },
      "created_at": "2026-08-17T21:00:00.000Z",
      "updated_at": "2026-08-17T21:00:00.000Z"
    },
    {
      "candidate_id": "lgfc-gehrig-2026-514",
      "input_stream": "scheduled_discovery",
      "title": "File:Henry Louis \"Lou\" Gehrig from Sports Exchange All-Stars trade cards (W603) MET DPB882285.jpg",
      "source_name": "Wikimedia Commons",
      "source_type": "archive",
      "source_domain": "commons.wikimedia.org",
      "source_url": "https://commons.wikimedia.org/wiki/File:Henry_Louis_%22Lou%22_Gehrig_from_Sports_Exchange_All-Stars_trade_cards_(W603)_MET_DPB882285.jpg",
      "content_type": "photo",
      "summary": "Lou Gehrig trade card print, Metropolitan Museum of Art collection. (Wikimedia Commons caption, uploader-provided -- not independently verified.)",
      "date_or_period": "1946–49",
      "people_tags": ["Lou Gehrig"],
      "topic_tags": ["baseball"],
      "location_tags": [],
      "credit_line": "Donated to Wikimedia Commons as part of a project by the Metropolitan Museum of Art (Image and Data Resources Open Access Policy)",
      "provenance_notes": "Wikimedia Commons discovery for query \"Lou Gehrig\", frozen from run 32066959698 (2026-08-17). License template: CC0 (http://creativecommons.org/publicdomain/zero/1.0/deed.en) -- no rights reserved. License template is an uploader assertion, not a verified fact.",
      "rights_status": "unknown",
      "source_trust_status": "trusted",
      "relevance_status": "relevant",
      "review_status": "pending_review",
      "publication_status": "not_ready",
      "privacy_flag": "none",
      "privacy_review_status": "not_applicable",
      "review_priority": "normal",
      "admin_notes": "Frozen approved-batch fixture for #3552. Rights conclusion recorded separately via rights_evidence per #3551's core safety rule.",
      "source_metadata": {
        "source_record_id": "File:Henry Louis \"Lou\" Gehrig from Sports Exchange All-Stars trade cards (W603) MET DPB882285.jpg",
        "date_accessed": "2026-08-17",
        "source_citation": "Wikimedia Commons, File:Henry Louis \"Lou\" Gehrig from Sports Exchange All-Stars trade cards (W603) MET DPB882285.jpg"
      },
      "created_at": "2026-08-17T21:00:00.000Z",
      "updated_at": "2026-08-17T21:00:00.000Z"
    },
    {
      "candidate_id": "lgfc-gehrig-2026-515",
      "input_stream": "scheduled_discovery",
      "title": "File:Lou Gehrig beating ball, Aug 27, 1928.jpg",
      "source_name": "Wikimedia Commons",
      "source_type": "archive",
      "source_domain": "commons.wikimedia.org",
      "source_url": "https://commons.wikimedia.org/wiki/File:Lou_Gehrig_beating_ball,_Aug_27,_1928.jpg",
      "content_type": "photo",
      "summary": "Caption text says \"Lou Gehrig beating out a slow roller in eighth inning of opener [vs. Detroit Tigers] which developed into the winning run. Note the ball.\" (Wikimedia Commons caption, uploader-provided -- not independently verified.)",
      "date_or_period": "1928-08-28",
      "people_tags": ["Lou Gehrig"],
      "topic_tags": ["baseball"],
      "location_tags": [],
      "credit_line": "New York Daily News, August 28, 1928, pg. 33 (https://www.newspapers.com/article/daily-news-lou-gehrig-beating-ball-aug/155797794/)",